{
  "artifact_policy": "digest_only_source_free",
  "blocked_execution_surfaces": [
    "decorator_evaluation",
    "device_access",
    "dynamic_library_loading",
    "frontend_package_import",
    "generated_artifact_execution",
    "native_backend_execution",
    "network_access",
    "plugin_discovery",
    "python_import",
    "subprocess_execution",
    "triton_jit_execution"
  ],
  "blocked_outputs": [
    "backend_artifact",
    "compute_graph",
    "generated_artifact",
    "hac_ir",
    "hs_ir",
    "python_function_object",
    "runtime_plan",
    "source_intent_plain_data",
    "tlir"
  ],
  "corpus_contract": "parser_fuzz_negative_corpus_for_admitting_slice.data_only.v0",
  "corpus_status": "complete_non_admitting",
  "diagnostic_class_coverage": [
    "hardware_specific_source",
    "invalid_shape_profile",
    "malformed_syntax",
    "resource_budget",
    "unsafe_execution_surface",
    "unsupported_semantics"
  ],
  "diagnostic_class_coverage_complete": true,
  "diagnostic_count": 8,
  "diagnostics": [
    {
      "case_id": "reject_malformed_function_syntax",
      "diagnostic_bytes": 377,
      "diagnostic_class": "malformed_syntax",
      "diagnostic_code": "TUC_SRC_DIAG_SYNTAX_ERROR",
      "emits_compute_graph": false,
      "emits_hac_ir": false,
      "emits_runtime_plan": false,
      "emits_source_intent_plain_data": false,
      "expected_outcome": "diagnostics_source_free_before_lowering",
      "includes_source_excerpt": false,
      "includes_source_location": false,
      "message_template_id": "diagnostic.syntax_error",
      "reason_code": "syntax_error",
      "source_digest": "sha256:6b8c8a725c23dc076d9a2c185ce4e02435746bc3b4f99906d13de360e56898c7",
      "source_free": true
    },
    {
      "case_id": "reject_line_budget_overflow",
      "diagnostic_bytes": 368,
      "diagnostic_class": "resource_budget",
      "diagnostic_code": "TUC_SRC_DIAG_LINE_BUDGET",
      "emits_compute_graph": false,
      "emits_hac_ir": false,
      "emits_runtime_plan": false,
      "emits_source_intent_plain_data": false,
      "expected_outcome": "diagnostics_source_free_before_lowering",
      "includes_source_excerpt": false,
      "includes_source_location": false,
      "message_template_id": "diagnostic.line_budget",
      "reason_code": "line_budget",
      "source_digest": "sha256:bb435be5e54e8eae25217d64e9c31a95a659d14e33b2d362d41e20f584c19c7f",
      "source_free": true
    },
    {
      "case_id": "reject_invalid_shape_profile",
      "diagnostic_bytes": 381,
      "diagnostic_class": "invalid_shape_profile",
      "diagnostic_code": "TUC_SRC_DIAG_SHAPE_PROFILE",
      "emits_compute_graph": false,
      "emits_hac_ir": false,
      "emits_runtime_plan": false,
      "emits_source_intent_plain_data": false,
      "expected_outcome": "diagnostics_source_free_before_lowering",
      "includes_source_excerpt": false,
      "includes_source_location": false,
      "message_template_id": "diagnostic.shape_profile",
      "reason_code": "shape_profile",
      "source_digest": "sha256:9e26bf369911c45c243c684147b23fc9e1dcfcf257d299a1c632016a6fcd33f4",
      "source_free": true
    },
    {
      "case_id": "reject_import_escape",
      "diagnostic_bytes": 385,
      "diagnostic_class": "unsafe_execution_surface",
      "diagnostic_code": "TUC_SRC_DIAG_IMPORT_STATEMENT",
      "emits_compute_graph": false,
      "emits_hac_ir": false,
      "emits_runtime_plan": false,
      "emits_source_intent_plain_data": false,
      "expected_outcome": "diagnostics_source_free_before_lowering",
      "includes_source_excerpt": false,
      "includes_source_location": false,
      "message_template_id": "diagnostic.import_statement",
      "reason_code": "import_statement",
      "source_digest": "sha256:1c91353ae96573ba677528635c412339fee1a0d643370aef60368c1a4633a188",
      "source_free": true
    },
    {
      "case_id": "reject_decorator_call",
      "diagnostic_bytes": 380,
      "diagnostic_class": "unsafe_execution_surface",
      "diagnostic_code": "TUC_SRC_DIAG_DECORATOR_CALL",
      "emits_compute_graph": false,
      "emits_hac_ir": false,
      "emits_runtime_plan": false,
      "emits_source_intent_plain_data": false,
      "expected_outcome": "diagnostics_source_free_before_lowering",
      "includes_source_excerpt": false,
      "includes_source_location": false,
      "message_template_id": "diagnostic.decorator_call",
      "reason_code": "decorator_call",
      "source_digest": "sha256:146f865c7b58a04e2e396a0a80f9dde7b38d29dba9d87a90dcb5bb7ada2d11dd",
      "source_free": true
    },
    {
      "case_id": "reject_hardware_hint_literal",
      "diagnostic_bytes": 402,
      "diagnostic_class": "hardware_specific_source",
      "diagnostic_code": "TUC_SRC_DIAG_HARDWARE_HINT",
      "emits_compute_graph": false,
      "emits_hac_ir": false,
      "emits_runtime_plan": false,
      "emits_source_intent_plain_data": false,
      "expected_outcome": "diagnostics_source_free_before_lowering",
      "includes_source_excerpt": false,
      "includes_source_location": false,
      "message_template_id": "diagnostic.hardware_specific_hint",
      "reason_code": "hardware_specific_hint",
      "source_digest": "sha256:81377a2f0776a9b31a425c2d9e26d7cb2e1d3f57188310cdc51d51f40ab9c2d0",
      "source_free": true
    },
    {
      "case_id": "reject_dynamic_tl_dispatch",
      "diagnostic_bytes": 388,
      "diagnostic_class": "unsupported_semantics",
      "diagnostic_code": "TUC_SRC_DIAG_DYNAMIC_DISPATCH",
      "emits_compute_graph": false,
      "emits_hac_ir": false,
      "emits_runtime_plan": false,
      "emits_source_intent_plain_data": false,
      "expected_outcome": "diagnostics_source_free_before_lowering",
      "includes_source_excerpt": false,
      "includes_source_location": false,
      "message_template_id": "diagnostic.dynamic_dispatch",
      "reason_code": "dynamic_dispatch",
      "source_digest": "sha256:a727b366a634e5c92ef87415e967a67f2888753845aac6f7dcaf7780c4e52df9",
      "source_free": true
    },
    {
      "case_id": "reject_report_unsafe_source_name",
      "diagnostic_bytes": 397,
      "diagnostic_class": "unsafe_execution_surface",
      "diagnostic_code": "TUC_SRC_DIAG_REPORT_SAFE_NAME",
      "emits_compute_graph": false,
      "emits_hac_ir": false,
      "emits_runtime_plan": false,
      "emits_source_intent_plain_data": false,
      "expected_outcome": "diagnostics_source_free_before_lowering",
      "includes_source_excerpt": false,
      "includes_source_location": false,
      "message_template_id": "diagnostic.report_safe_name",
      "reason_code": "report_safe_name",
      "source_digest": "sha256:585c93666fcb046b7b264d3fa73202aa2a38254ae82a4b3ba19e873c2d5a9886",
      "source_free": true
    }
  ],
  "diagnostics_contract": "source_free_diagnostics_admission_tests.data_only.v0",
  "diagnostics_status": "complete_non_admitting",
  "evidence_id": "source_free_diagnostics_admission_tests",
  "expected_outcome": "diagnostics_source_free_before_lowering",
  "issues": [],
  "location_policy": "no_source_locations",
  "message_policy": "message_template_id_only",
  "message_template_coverage": [
    "diagnostic.decorator_call",
    "diagnostic.dynamic_dispatch",
    "diagnostic.hardware_specific_hint",
    "diagnostic.import_statement",
    "diagnostic.line_budget",
    "diagnostic.report_safe_name",
    "diagnostic.shape_profile",
    "diagnostic.syntax_error"
  ],
  "message_template_coverage_complete": true,
  "parser_fuzz_evidence": {
    "contract": "parser_fuzz_negative_corpus_for_admitting_slice.data_only.v0",
    "digest": "sha256:2848534ad8b9d42297b8413ca8ac3200ee0a0a4f072e38f5a6b950c2d943d120",
    "evidence_id": "parser_fuzz_negative_corpus_for_admitting_slice",
    "source_free": true,
    "status": "complete_non_admitting",
    "supports_diagnostics": true
  },
  "payload_policy": "reason_code_digest_only",
  "reason_code_coverage": [
    "decorator_call",
    "dynamic_dispatch",
    "hardware_specific_hint",
    "import_statement",
    "line_budget",
    "report_safe_name",
    "shape_profile",
    "syntax_error"
  ],
  "report_digest": "sha256:15d7299df650e6778c6fa005ab1d7aa68aa8251ecc940598d8af6d44e3d6b868",
  "required_control_count": 18,
  "required_controls": [
    "parser_fuzz_negative_corpus_bound",
    "diagnostic_code_manifest",
    "message_template_id_only",
    "source_digest_only",
    "source_free_diagnostic_payload",
    "bounded_diagnostic_count",
    "bounded_diagnostic_bytes",
    "no_source_excerpt",
    "no_line_column_locations",
    "fail_closed_before_lowering",
    "no_source_to_intent_plain_data",
    "no_source_to_compute_graph",
    "no_source_to_hac_ir",
    "no_source_to_runtime_plan",
    "no_python_import",
    "no_triton_jit",
    "no_device_access",
    "no_generated_artifacts"
  ],
  "required_reason_coverage_complete": true,
  "schema_version": "tuc.source_free_diagnostics_admission_tests_report.v0",
  "source_to_compute_graph": false,
  "source_to_hac_ir": false,
  "source_to_intent_plain_data": false,
  "source_to_runtime_plan": false,
  "target_slice": "bounded_source_buffer_to_source_intent_plain_data"
}
